{
  "schema_version": "4.0",
  "judge_id": "case001-v2.judge-v1",
  "case_id": "case001-v2",
  "version": "1",
  "implementation_file": "scripts/judge_csv.py",
  "implementation_sha256": "4df233da7f7c1a944f681956a3518b747f10ca7fcb368cc461e8e6bf2c92b5a0",
  "reference_file": "scripts/reference_csv.py",
  "reference_sha256": "a168a897a3dee2bbcdb00a31df6080ff776c2ecd658a22aa589e84bb35179778",
  "policy": "Frozen expected bytes, declared invalid-input behavior, no extra outputs, input unchanged",
  "limitations": [
    "Only the existing 11 development fixtures are benchmark data",
    "Not a complete timestamp or quoting test matrix",
    "No generated-skill executor or OS sandbox is implemented",
    "Independent human reference and test review pending"
  ]
}
